titulo;termoLatim;outrosNomes;novasTerminologias;descricao;formaLogica;exemplo1;explicacao1;exemplo2;explicacao2;exemplo3;explicacao3;exemplo4;explicacao4;excecao;curiosidades;variacao;dica;referencias;
falácia de sotaque;accentus;(também conhecido como:  falácia da ênfase, falácia do sotaque, falácia da prosódia, sotaque enganoso) ;;Descrição: Quando o significado de uma palavra, frase ou ideia inteira é interpretado de forma diferente, mudando onde o acento cai. ;Forma Lógica: A reivindicação é feita com ênfase na palavra X, dando à reivindicação o significado de Y. A reivindicação é interpretada com ênfase na palavra A, dando à reivindicação o significado de B. ;Exemplo #1: No filme, Meu Primo Vinny, o personagem de Ralph Maccio, Bill, foi interrogado por suspeita de assassinato. Quando o policial pergunta a ele: "Em que momento você atirou no balconista?" Bill responde em estado de choque: "Eu atirei no balconista? Eu atirei no balconista?" Mais tarde no filme, o policial lê a declaração de Bill como uma confissão no tribunal, "... e ele disse: 'Eu atirei no balconista. Eu atirei no balconista.'" ;Explicação: No filme, parece que o policial entendeu a pergunta de Bill como uma confissão. Portanto, não parecia ser uma tática falaciosa do policial, mas uma falha de pensamento crítico, talvez devido a um forte viés de confirmação (o policial estava muito confiante de que Bill era culpado, portanto, falhou em detectar a nuance da pergunta). ;Exemplo nº 2: No hilário musical da Broadway, O Livro de Mórmon, há um número musical em que um personagem explica como enterrar "maus pensamentos" simplesmente "desligando-os" (como um interruptor de luz). O personagem que explica (em uma canção gloriosa) está especificamente explicando ao personagem principal como suprimir os pensamentos gays quando os "pensamentos ruins" do personagem principal não têm nada a ver com ser gay. Após as instruções, o personagem principal tenta deixar isso claro afirmando: "Não estou tendo pensamentos gays", ao que os outros personagens respondem "Viva! Funcionou!" ;Explicação: A ênfase no "eu sou" foi ignorada e confundida com "Ei, não estou mais tendo pensamentos gays!" Embora fosse uma comédia, retratava uma discussão. ;;;;;;;;Dica: Nossos preconceitos podem fazer com que percamos a nuance vocal. Ouça de forma ativa e crítica e tente não tirar conclusões precipitadas. E você não pode desligar os pensamentos gays como um interruptor de luz. ;Referências: Damer, T. E. (2008). Atacando o raciocínio falho: um guia prático para argumentos livres de falácias. Cengage Learning. 
falácia do acidente;a dicto simpliciter ad dictum secundum quid;(também conhecido como: destruindo a exceção, dicto secundum quid ad dictum simpliciter, dicto simpliciter, acidente inverso, acidente reverso, falácia da regra geral, generalização abrangente) ;;Descrição: Quando se tenta aplicar uma regra geral a todas as situações em que claramente existem exceções à regra. Regras ou leis simplistas raramente levam em consideração exceções legítimas, e ignorar essas exceções é contornar a razão para preservar a ilusão de uma lei perfeita. As pessoas gostam de simplicidade e muitas vezes preferem manter a simplicidade em detrimento da racionalidade. ;Forma Lógica: X é uma regra comum e aceita. Portanto, não há exceções para X. ;Exemplo 1: Acredito que nunca se deve ferir deliberadamente outra pessoa, por isso nunca poderei ser cirurgião. ;Explicação: Classificar a cirurgia como “magoando” alguém é ignorar os benefícios óbvios que acompanham a cirurgia. Esses tipos de visões extremas raramente são construídos com base na razão. ;Exemplo #2: A Bíblia diz claramente: “Não dirás falso testemunho”. Portanto, como cristão, é melhor você abrir a porta e contar ao nosso vizinho bêbado com a espingarda, que sua esposa, a quem ele está tentando matar, está escondida em nosso porão. Caso contrário, você está desafiando o próprio Deus! ;Explicação: Supor que qualquer lei, mesmo divina, se aplica a todas as pessoas, em todos os tempos, em todas as situações, mesmo que não explicitamente declarada, é uma suposição não fundamentada em evidências e um raciocínio falacioso. ;;;;;Exceção: Declarar a regra geral quando um bom argumento pode ser feito de que a ação em questão é uma violação da regra não seria considerado falacioso. A Bíblia diz: “Não matarás”, portanto, como cristão, é melhor você largar essa motosserra e desamarrar aquela criança. ;;;Dica: É seu direito questionar leis que não entende ou com as quais não concorda. ;Referências: 
Ad Fidentia;argumentum ad fidentia;(também conhecido como: contra a autoconfiança) ;;Descrição: Atacar a autoconfiança da pessoa no lugar do argumento ou da evidência. ;Forma Lógica: A pessoa 1 afirma que Y é verdadeiro, mas a pessoa 1 está realmente certa disso? Portanto, Y é falso. ;Exemplo 1: Rick: Ontem à noite sonhei que ganhei na loteria! Tenho $ 1.000 economizados, então estou comprando 1.000 ingressos! Vici: Você sabe, os sonhos não são formas precisas de prever o futuro; eles são simplesmente o resultado do disparo aleatório de neurônios. Rick: A última vez que verifiquei, você não é um neurologista ou psicólogo, então você tem certeza de que não estou vendo o futuro? Vici: É possível que você esteja vendo o futuro, eu acho. ;Explicação: Embora Vici esteja tentando argumentar com seu amigo, Rick tenta enfraquecer o argumento de Vici deixando Vici mais inseguro de sua posição. Esta é uma tática falaciosa de Rick, e se Vici cair nela, raciocínio falacioso de sua parte. ;Exemplo #2: Chris: Você afirma que não acredita no mundo espiritual que está ao nosso redor, com espíritos entrando e saindo de nós o tempo todo. Como você pode ter certeza de que não é esse o caso? Você tem 100% de certeza? Joe: Claro que não, como posso ser? Cris: Exatamente! Um ponto para mim! Joo: O que? ;Explicação: Esta é uma falácia comum entre aqueles que defendem o sobrenatural ou qualquer outra coisa não falsificável. Se Joe não fosse um pensador tão razoável, então ele poderia começar a questionar a validade de sua posição, não com base em nenhuma nova contraprova apresentada, mas em um ataque direto à sua autoconfiança. Felizmente para Joe, ele não possui crenças dogmáticas e está perfeitamente ciente da diferença entre possibilidades e probabilidades (veja também apelo à possibilidade). ;;;;;Exceção: Quando alguém reivindica certeza para algo onde a certeza é incognoscível, é seu dever apontar isso. ;;;Dica: Tenha certeza de que você provavelmente ou muito provavelmente está certo, mas evite a certeza dogmática a todo custo em áreas onde a certeza é incognoscível. ;Referências: 
Resgate ad hoc;ad hoc;(também conhecido como: inventar coisas, falácia MSU) ;;Descrição: Muitas vezes queremos desesperadamente estar certos e nos apegar a certas crenças, apesar de qualquer evidência apresentada em contrário. Como resultado, começamos a inventar desculpas para explicar por que nossa crença ainda pode ser verdadeira, e ainda é verdadeira, apesar do fato de não termos nenhuma evidência real do que estamos inventando. ;Forma Lógica: A afirmação X é verdadeira por causa da evidência Y. A evidência Y é demonstrada como não sendo uma evidência aceitável. Portanto, deve-se adivinhar Z então, mesmo que não haja evidência para adivinhar Z. ;Exemplo 1: Frieda: Só sei que Raymond está esperando para me convidar para sair. Edna: Ele está saindo com Rose há três meses. Frieda: Ele só está saindo com ela para me deixar com ciúmes. Edna: Eles estão noivos. Frieda: Bem, essa é apenas a maneira dele de garantir que eu saiba disso. ;Explicação: Além de estar um pouco iludida, a pobre Frieda se recusa a aceitar as evidências que levam a uma verdade que ela não está pronta para aceitar. Como resultado, ela cria uma razão ad hoc na tentativa de resgatar sua reivindicação inicial. ;Exemplo #2: Mark: O presidente dos EUA é o pior presidente de todos os tempos porque o desemprego nunca foi tão ruim antes! Sam: Na verdade, foi pior em 1982 e muito pior na década de 1930. Além disso, o presidente pode ser apenas parcialmente responsável pela economia durante seu mandato. Mark: Bem... o presidente chuta animais quando ninguém está olhando. ;Explicação: Desesperado, Mark faz uma reclamação sobre o tratamento particular dos animais pelo presidente depois que sua afirmação original foi refutada. ;;;;;Exceção: Propor soluções possíveis é perfeitamente aceitável quando um argumento sugere apenas uma solução possível – especialmente em uma situação hipotética. Por exemplo: “Se Deus não existe, então a vida não tem sentido”. Se não existe um Deus que dê sentido às nossas vidas, talvez sejamos verdadeiramente livres para encontrar o nosso próprio sentido. ;;;Dica: quando você suspeitar que as pessoas estão apenas inventando coisas, em vez de fornecer evidências para apoiar sua afirmação, simplesmente pergunte a elas: “Que evidências você tem para apoiar isso?” ;Referências: 
Ad Hominem (Abusivo);argumentum ad hominem;(também conhecido como: abuso pessoal, ataques pessoais, falácia abusiva, apelo à pessoa, condenação da fonte, xingamentos, refutação por caricatura, contra a pessoa, contra o homem) ;;Descrição: Atacar a pessoa que está argumentando, em vez do argumento em si, quando o ataque à pessoa é completamente irrelevante para o argumento que a pessoa está apresentando. ;Forma Lógica: A pessoa 1 está reivindicando Y. A pessoa 1 é um idiota. Portanto, Y não é verdadeiro. ;Exemplo 1: Meu oponente sugere que reduzir os impostos será uma boa ideia - isso vem de uma mulher que come meio litro de Ben and Jerry's todas as noites! ;Explicação: O fato de a mulher amar seu sorvete não tem nada a ver com a redução de impostos e, portanto, é irrelevante para o argumento. Os ataques ad hominem geralmente são feitos por desespero quando não se consegue encontrar um contra-argumento decente. ;Exemplo #2: Tony quer que acreditemos que a origem da vida foi um “acidente”. Tony é um filho da puta ímpio que passou mais tempo na prisão do que na igreja, então a única informação que devemos considerar dele é a melhor maneira de fazer placas. ;Explicação: Tony pode ser um filho da puta ímpio. Talvez ele tenha passado mais tempo na junta do que na igreja, mas tudo isso é irrelevante para seu argumento ou verdade de sua afirmação quanto à origem da vida. ;;;;;Exceção: Quando o ataque à pessoa é relevante para o argumento, não é uma falácia. Em nosso primeiro exemplo, se a questão em debate fosse a eliminação de impostos apenas sobre o sorvete Ben and Jerry's, apontar os hábitos alimentares dela seria uma forte evidência de um conflito de interesses. ;;;Dica: quando outros o atacarem verbalmente, considere isso um elogio à qualidade de seu argumento. Geralmente é um sinal de desespero da parte deles. ;Referências: Walton, D. (1998). Argumentos ad hominem. Imprensa da Universidade do Alabama. 
